{
  "required" : true ,
  "$schema" : "http://json-schema.org/draft-03/schema" ,
  "type" : "object" ,
  "properties" : {
    "alternateNames" : {
      "type" : "array" ,
      "required" : false ,
      "items" : [
        {
          "type" : "object" ,
          "properties" : {
            "name" : {
              "type" : "string" ,
              "required" : false
            } ,
            "lang" : {
              "type" : "string" ,
              "required" : false
            }
          }
        }
      ]
    } ,
    "countryName" : {
      "type" : "string" ,
      "required" : false
    } ,
    "adminCode1" : {
      "type" : "string" ,
      "required" : false
    } ,
    "lng" : {
      "type" : "string" ,
      "required" : false
    } ,
    "adminName2" : {
      "type" : "string" ,
      "required" : false
    } ,
    "fcodeName" : {
      "type" : "string" ,
      "required" : false
    } ,
    "adminName3" : {
      "type" : "string" ,
      "required" : false
    } ,
    "timezone" : {
      "type" : "object" ,
      "required" : false ,
      "properties" : {
        "dstOffset" : {
          "type" : "number" ,
          "required" : false
        } ,
        "gmtOffset" : {
          "type" : "number" ,
          "required" : false
        } ,
        "timeZoneId" : {
          "type" : "string" ,
          "required" : false
        }
      }
    } ,
    "adminName4" : {
      "type" : "string" ,
      "required" : false
    } ,
    "adminName5" : {
      "type" : "string" ,
      "required" : false
    } ,
    "bbox" : {
      "type" : "object" ,
      "required" : false ,
      "properties" : {
        "south" : {
          "type" : "number" ,
          "required" : false
        } ,
        "east" : {
          "type" : "number" ,
          "required" : false
        } ,
        "north" : {
          "type" : "number" ,
          "required" : false
        } ,
        "west" : {
          "type" : "number" ,
          "required" : false
        }
      }
    } ,
    "name" : {
      "type" : "string" ,
      "required" : false
    } ,
    "fcode" : {
      "type" : "string" ,
      "required" : false
    } ,
    "geonameId" : {
      "type" : "number" ,
      "required" : false
    } ,
    "lat" : {
      "type" : "string" ,
      "required" : false
    } ,
    "population" : {
      "type" : "number" ,
      "required" : false
    } ,
    "adminName1" : {
      "type" : "string" ,
      "required" : false
    } ,
    "countryId" : {
      "type" : "string" ,
      "required" : false
    } ,
    "adminId1" : {
      "type" : "string" ,
      "required" : false
    } ,
    "fclName" : {
      "type" : "string" ,
      "required" : false
    } ,
    "countryCode" : {
      "type" : "string" ,
      "required" : false
    } ,
    "srtm3" : {
      "type" : "number" ,
      "required" : false
    } ,
    "toponymName" : {
      "type" : "string" ,
      "required" : false
    } ,
    "fcl" : {
      "type" : "string" ,
      "required" : false
    } ,
    "continentCode" : {
      "type" : "string" ,
      "required" : false
    }
  }
}